{
  "$schema": "./schema.json",
  "name": "S1",
  "description": "Many small jobs: 2062 jobs/hr x 97 tasks/job.",
  "durationMinutes": 60,
  "jobsPerHour": 2062,
  "tasksPerJob": 97,
  "arrival": "poisson",
  "workers": 200,
  "poolSize": 200,
  "distribution": "uniform",
  "idRange": [1, 1000000],
  "thinkMsMin": 50,
  "thinkMsMax": 250,
  "writeConcern": "w1",
  "warmupMinutes": 5,
  "warmupFractionOfTarget": 0.10
}
