{
  "$schema": "./schema.json",
  "name": "S2",
  "description": "Prod peak hour (primary KPI): 1099 jobs/hr x 441 tasks/job ~= 135 tasks/s.",
  "durationMinutes": 60,
  "jobsPerHour": 1099,
  "tasksPerJob": 441,
  "arrival": "poisson",
  "workers": 500,
  "poolSize": 500,
  "distribution": "uniform",
  "idRange": [1, 1000000],
  "thinkMsMin": 50,
  "thinkMsMax": 250,
  "writeConcern": "w1",
  "warmupMinutes": 5,
  "warmupFractionOfTarget": 0.10
}
