{
  "$schema": "./schema.json",
  "name": "smoke",
  "description": "10-second tiny scenario to validate connectivity and the full op pipeline.",
  "durationMinutes": 1,
  "jobsPerHour": 360,
  "tasksPerJob": 5,
  "arrival": "poisson",
  "workers": 4,
  "poolSize": 10,
  "distribution": "uniform",
  "idRange": [1, 1000000],
  "thinkMsMin": 10,
  "thinkMsMax": 50,
  "writeConcern": "w1",
  "warmupMinutes": 0,
  "warmupFractionOfTarget": 0.0
}
