{
  "$schema": "./schema.json",
  "name": "warmup",
  "description": "5-minute warmup at 10% of S2 to prime pools, caches, and connections.",
  "durationMinutes": 5,
  "jobsPerHour": 110,
  "tasksPerJob": 441,
  "arrival": "poisson",
  "workers": 50,
  "poolSize": 50,
  "distribution": "uniform",
  "idRange": [1, 1000000],
  "thinkMsMin": 50,
  "thinkMsMax": 250,
  "writeConcern": "w1",
  "warmupMinutes": 0,
  "warmupFractionOfTarget": 0.10
}
